{
  "schema_version": "0.1",
  "id": "mailchimp",
  "annotation": {
    "status": "pilot_partial",
    "method": "Assistant visual inspection of all 50 overview/full-page thumbnails and readable top-window crops; manual hero-copy transcription; local Apple Vision OCR of full screenshots.",
    "coverage": [
      "Visible headline and selected actions",
      "Supporting hero copy where recorded",
      "Industry/audience/intended action retrieval facets",
      "Observed desktop composition and evidence images"
    ],
    "unreviewed": [
      "Full-page OCR transcription candidates",
      "Precise semantic body-section segmentation",
      "Runtime and responsive behavior"
    ]
  },
  "provenance": {
    "gallery_url": "https://saaslandingpage.com/mailchimp",
    "gallery_saved_at": "2026-09-29T15:13:56.776Z",
    "original_site_url": null,
    "screenshot_captured_at": null,
    "gallery_meta_path": "provenance/mailchimp-meta.json",
    "gallery_text_path": "provenance/mailchimp-gallery.txt"
  },
  "images": [
    {
      "id": "full",
      "path": "screenshots/mailchimp.png",
      "sha256": "1584eb865856f8811f3c822794feae95de4aea6d295717754098c0513f3dfd6c",
      "width": 1440,
      "height": 8952,
      "role": "source",
      "parent_id": null,
      "bbox_px": null
    },
    {
      "id": "hero-window",
      "path": "crops/mailchimp-hero.png",
      "sha256": "1b878057099a2601aaa15b516369ee5cdee839121abf919a797d1c861e1e3e1f",
      "width": 1440,
      "height": 1000,
      "role": "crop",
      "parent_id": "full",
      "bbox_px": [
        0,
        0,
        1440,
        1000
      ]
    }
  ],
  "retrieval": {
    "page_kind": "landing-page",
    "summary": "Centered serif copy and a yellow action lead into four adjacent feature panels mixing product UI, people, and objects.",
    "tags": [
      "industry:Marketing and sales",
      "audience:Marketing teams",
      "conversion_goal:signup",
      "style:editorial-showcase",
      "color_family:yellow",
      "hero_layout:centered"
    ]
  },
  "claims": [
    {
      "field": "industry",
      "value": "Marketing and sales",
      "basis": "interpretation",
      "confidence": "medium",
      "evidence_ids": [
        "hero-window",
        "full"
      ]
    },
    {
      "field": "audience",
      "value": "Marketing teams",
      "basis": "interpretation",
      "confidence": "medium",
      "evidence_ids": [
        "hero-window",
        "full"
      ]
    },
    {
      "field": "conversion_goal",
      "value": "signup",
      "basis": "interpretation",
      "confidence": "medium",
      "evidence_ids": [
        "hero-window",
        "full"
      ]
    },
    {
      "field": "style",
      "value": "editorial-showcase",
      "basis": "interpretation",
      "confidence": "medium",
      "evidence_ids": [
        "hero-window",
        "full"
      ]
    },
    {
      "field": "color_family",
      "value": "yellow",
      "basis": "screenshot_observation",
      "confidence": "high",
      "evidence_ids": [
        "hero-window",
        "full"
      ]
    },
    {
      "field": "hero_layout",
      "value": "centered",
      "basis": "screenshot_observation",
      "confidence": "high",
      "evidence_ids": [
        "hero-window",
        "full"
      ]
    }
  ],
  "sections": [
    {
      "id": "top-window",
      "order": 0,
      "role": "top-page-evidence-window",
      "pattern": "centered",
      "takeaway": "Turn Emails into Revenue",
      "evidence_ids": [
        "hero-window",
        "full"
      ],
      "observations": [
        "Centered serif copy and a yellow action lead into four adjacent feature panels mixing product UI, people, and objects.",
        "Window includes the page header and may include the start of subsequent content."
      ],
      "visible_affordances": [
        "Sign Up"
      ],
      "runtime_verified": false
    },
    {
      "id": "remaining-page",
      "order": 1,
      "role": "unsegmented-page-body",
      "pattern": "unclassified",
      "takeaway": "Inspect the full screenshot; detailed body annotation is pending.",
      "evidence_ids": [
        "full"
      ],
      "observations": [
        "Full-page visual evidence and unreviewed OCR are retained."
      ],
      "visible_affordances": [],
      "runtime_verified": false
    }
  ],
  "recipes": [],
  "unknowns": [
    "No conversion-performance data; conversion_goal describes an intended visible action.",
    "No verified mobile layout, animation, interaction, DOM, source code, font names, or CSS spacing values.",
    "Screenshot capture date is unknown; gallery savedAt is the download date.",
    "Full-page semantic section boundaries and body copy classification remain unreviewed.",
    "The first 1000 pixels are an evidence window, not a browser viewport or exact hero boundary.",
    "Copy text omits decorative icons; text punctuation is transcribed as visible, but font-specific glyph identity is not established."
  ],
  "copy_blocks": [
    {
      "id": "copy-01",
      "section_id": "top-window",
      "role": "headline",
      "text_verbatim": "Turn Emails into Revenue",
      "visible_lines": [],
      "evidence_ids": [
        "hero-window",
        "full"
      ],
      "reading_order": 0,
      "transcription_status": "visually_verified",
      "uncertainties": [
        "Visual line wrapping is not transcribed; use the screenshot.",
        "Reading order is grouped editorially by copy role, not a DOM reading-order measurement."
      ]
    },
    {
      "id": "copy-02",
      "section_id": "top-window",
      "role": "supporting_copy",
      "text_verbatim": "Win new customers with the #1 email marketing and automations brand* that recommends ways to get more opens, clicks, and sales.",
      "visible_lines": [],
      "evidence_ids": [
        "hero-window",
        "full"
      ],
      "reading_order": 1,
      "transcription_status": "visually_verified",
      "uncertainties": [
        "Visual line wrapping is not transcribed; use the screenshot.",
        "Reading order is grouped editorially by copy role, not a DOM reading-order measurement."
      ]
    },
    {
      "id": "copy-03",
      "section_id": "top-window",
      "role": "cta",
      "text_verbatim": "Sign Up",
      "visible_lines": [],
      "evidence_ids": [
        "hero-window",
        "full"
      ],
      "reading_order": 2,
      "transcription_status": "visually_verified",
      "uncertainties": [
        "Visual line wrapping is not transcribed; use the screenshot.",
        "Reading order is grouped editorially by copy role, not a DOM reading-order measurement."
      ]
    }
  ],
  "transcription_candidates": [
    {
      "id": "ocr-0001",
      "section_id": "top-window",
      "text_raw": "Sales:",
      "bbox_px": [
        1016,
        25,
        1058,
        42
      ],
      "ocr_confidence": 1,
      "evidence_ids": [
        "full"
      ],
      "status": "ocr_unreviewed",
      "content_scope": "unclassified"
    },
    {
      "id": "ocr-0002",
      "section_id": "top-window",
      "text_raw": "INTUIT",
      "bbox_px": [
        669,
        28,
        713,
        39
      ],
      "ocr_confidence": 1,
      "evidence_ids": [
        "full"
      ],
      "status": "ocr_unreviewed",
      "content_scope": "unclassified"
    },
    {
      "id": "ocr-0003",
      "section_id": "top-window",
      "text_raw": "Products",
      "bbox_px": [
        41,
        33,
        107,
        50
      ],
      "ocr_confidence": 1,
      "evidence_ids": [
        "full"
      ],
      "status": "ocr_unreviewed",
      "content_scope": "unclassified"
    },
    {
      "id": "ocr-0004",
      "section_id": "top-window",
      "text_raw": "Inspiration",
      "bbox_px": [
        261,
        33,
        339,
        49
      ],
      "ocr_confidence": 1,
      "evidence_ids": [
        "full"
      ],
      "status": "ocr_unreviewed",
      "content_scope": "unclassified"
    },
    {
      "id": "ocr-0005",
      "section_id": "top-window",
      "text_raw": "Resources",
      "bbox_px": [
        146,
        36,
        222,
        49
      ],
      "ocr_confidence": 1,
      "evidence_ids": [
        "full"
      ],
      "status": "ocr_unreviewed",
      "content_scope": "unclassified"
    },
    {
      "id": "ocr-0006",
      "section_id": "top-window",
      "text_raw": "Pricing",
      "bbox_px": [
        378,
        36,
        431,
        52
      ],
      "ocr_confidence": 1,
      "evidence_ids": [
        "full"
      ],
      "status": "ocr_unreviewed",
      "content_scope": "unclassified"
    },
    {
      "id": "ocr-0007",
      "section_id": "top-window",
      "text_raw": "& mailchimp",
      "bbox_px": [
        645,
        36,
        797,
        60
      ],
      "ocr_confidence": 1,
      "evidence_ids": [
        "full"
      ],
      "status": "ocr_unreviewed",
      "content_scope": "unclassified"
    },
    {
      "id": "ocr-0008",
      "section_id": "top-window",
      "text_raw": "Log In",
      "bbox_px": [
        1181,
        36,
        1230,
        52
      ],
      "ocr_confidence": 1,
      "evidence_ids": [
        "full"
      ],
      "status": "ocr_unreviewed",
      "content_scope": "unclassified"
    },
    {
      "id": "ocr-0009",
      "section_id": "top-window",
      "text_raw": "Sign Up Free",
      "bbox_px": [
        1288,
        36,
        1372,
        52
      ],
      "ocr_confidence": 1,
      "evidence_ids": [
        "full"
      ],
      "status": "ocr_unreviewed",
      "content_scope": "unclassified"
    },
    {
      "id": "ocr-0010",
      "section_id": "top-window",
      "text_raw": "+1 (800) 315-5939",
      "bbox_px": [
        943,
        47,
        1058,
        60
      ],
      "ocr_confidence": 1,
      "evidence_ids": [
        "full"
      ],
      "status": "ocr_unreviewed",
      "content_scope": "unclassified"
    },